{
  "signal_id": "UI-001",
  "track": "UI",
  "observed_at": "2026-07-20T09:00:00Z",
  "severity": "HIGH",
  "status": "AMENDMENT_CANDIDATE",
  "summary": "Users confuse Draft and Result on the final screen.",
  "evidence": [
    "SRC-002"
  ],
  "affected_parts": [
    "Product Architecture",
    "Ontology",
    "Eval & Audit"
  ],
  "affected_theme_ids": [
    "THEME-002"
  ],
  "recommended_action": "Test revised labels and state separation."
}
